{
  "schema": "artifact/assignment",
  "version": 1,
  "id": "A-S1",
  "slice_id": "S1",
  "mission": "Write the plan.schema.json file with required fields",
  "source_ids": ["USR-001", "DEC-001"],
  "acceptance_ids": ["AC1"],
  "capability_class": "standard",
  "write_paths": ["schemas/plan.schema.json"],
  "context_paths": ["rules/10-execution-planning-delegation.md"],

  "forbidden_paths": ["automation/"],
  "allowed_tool_classes": ["read", "edit", "test", "shell", "git"],
  "receipt_budget": 10,
  "ack_status": "acknowledged",
  "actor_session": "session-s1-worker",
  "capsule_hash": "abcdef0123456789abcdef0123456789abcdef0123456789abcdef0123456789",
  "created_at": "2026-07-25T08:00:00Z"
}
